ATA device, with non-removable media
  Model Number:       EK001600GWEPH
  Serial Number:      S3E9NX0J703575
  Firmware Revision:  HPG0
  Transport:          Serial, ATA8-AST, SATA 1.0a, SATA II Extensions, SATA Rev 2.5, SATA Rev 2.6, SATA Rev 3.0
Standards:
  Used: unknown (minor revision code 0x006d)
  Supported: 10 9 8 7 6 5
  Likely used: 10
Configuration:
  Logical   max current
  cylinders 16383 0
  heads   16  0
  sectors/track 63  0
  --
  LBA    user addressable sectors:   268435455
  LBA48  user addressable sectors:  3125627568
  Logical  Sector size:                   512 bytes
  Physical Sector size:                   512 bytes
  Logical Sector-0 offset:                  0 bytes
  device size with M = 1024*1024:     1526185 MBytes
  device size with M = 1000*1000:     1600321 MBytes (1600 GB)
  cache/buffer size  = unknown
  Form Factor: 2.5 inch
  Nominal Media Rotation Rate: Solid State Device
Capabilities:
  LBA, IORDY(can be disabled)
  Queue depth: 32
  Standby timer values: spec'd by Standard, with device specific minimum
  R/W multiple sector transfer: Max = 16  Current = 16
  DMA: mdma0 mdma1 mdma2 udma0 udma1 udma2 udma3 udma4 udma5 *udma6
       Cycle time: min=120ns recommended=120ns
  PIO: pio0 pio1 pio2 pio3 pio4
       Cycle time: no flow control=120ns  IORDY flow control=120ns
Commands/features:
  Enabled Supported:
     *  SMART feature set
     *  Power Management feature set
        Write cache
     *  Look-ahead
     *  WRITE_BUFFER command
     *  READ_BUFFER command
     *  NOP cmd
     *  DOWNLOAD_MICROCODE
     *  48-bit Address feature set
     *  Mandatory FLUSH_CACHE
     *  FLUSH_CACHE_EXT
     *  SMART error logging
     *  SMART self-test
     *  General Purpose Logging feature set
     *  WRITE_{DMA|MULTIPLE}_FUA_EXT
     *  64-bit World wide name
        Write-Read-Verify feature set
     *  WRITE_UNCORRECTABLE_EXT command
     *  {READ,WRITE}_DMA_EXT_GPL commands
     *  Segmented DOWNLOAD_MICROCODE
     *  Gen1 signaling speed (1.5Gb/s)
     *  Gen2 signaling speed (3.0Gb/s)
     *  Gen3 signaling speed (6.0Gb/s)
     *  Native Command Queueing (NCQ)
     *  Phy event counters
     *  READ_LOG_DMA_EXT equivalent to READ_LOG_EXT
     *  DMA Setup Auto-Activate optimization
     *  Asynchronous notification (eg. media change)
     *  Software settings preservation
     *  SMART Command Transport (SCT) feature set
     *  SCT Write Same (AC2)
     *  SCT Data Tables (AC5)
     *  SANITIZE_ANTIFREEZE_LOCK_EXT command
     *  SANITIZE feature set
     *  BLOCK_ERASE_EXT command
     *  reserved 69[4]
     *  WRITE BUFFER DMA command
     *  READ BUFFER DMA command
     *  Data Set Management TRIM supported (limit 8 blocks)
     *  Deterministic read ZEROs after TRIM
Logical Unit WWN Device Identifier: 5002538c406e5069
  NAA   : 5
  IEEE OUI  : 002538
  Unique ID : c406e5069